{
  "generated_at": "2026-08-06T00:00:00+00:00",
  "manifest_version": "agent_data_routes_20260812_v1",
  "schema_version": "agent_data_route_manifest_v1",
  "agent_tool_contract_manifest_hash": "sha256:cd74e754de85a804bd2f263c13940bab208b9b76f52718aeb20f936015ec3dfb",
  "routes": [
    {
      "contract_version": "alfred_us_macro_v1",
      "implementation_stage": "PR5",
      "pit_strategy": "AUTHORITATIVE_VINTAGE_REPLAY",
      "route_id": "alfred.us_macro",
      "source_family": "alfred"
    },
    {
      "contract_version": "composite_cn_rates_mof_chinabond_v1",
      "implementation_stage": "PR15",
      "pit_strategy": "OBSERVED_LIVE",
      "route_id": "composite.cn_rates",
      "source_family": "composite"
    },
    {
      "contract_version": "ecb_eu_real_economy_history_v1",
      "implementation_stage": "PR15",
      "pit_strategy": "AUTHORITATIVE_VINTAGE_REPLAY",
      "route_id": "ecb.eu_real_economy",
      "source_family": "ecb"
    },
    {
      "contract_version": "ecb_euro_macro_v2",
      "implementation_stage": "PR15",
      "pit_strategy": "AUTHORITATIVE_VINTAGE_REPLAY",
      "route_id": "ecb.euro_macro",
      "source_family": "ecb"
    },
    {
      "contract_version": "euro_fx_market_v1",
      "implementation_stage": "PR6",
      "pit_strategy": "OBSERVED_LIVE",
      "route_id": "market.euro_fx",
      "source_family": "market"
    },
    {
      "contract_version": "us_market_conditions_v1",
      "implementation_stage": "PR5",
      "pit_strategy": "OBSERVED_LIVE",
      "route_id": "market.us_conditions",
      "source_family": "market"
    },
    {
      "contract_version": "official_cn_macro_v1",
      "implementation_stage": "PR7",
      "pit_strategy": "FORWARD_ARCHIVE",
      "route_id": "official.cn_macro",
      "source_family": "official_cn"
    },
    {
      "contract_version": "company_supply_chain_disclosures_v1",
      "implementation_stage": "PR6",
      "pit_strategy": "AUTHORITATIVE_VINTAGE_REPLAY",
      "route_id": "official.company_supply_chain_disclosures",
      "source_family": "official_company_disclosures"
    },
    {
      "contract_version": "govcn_policy_forward_archive_v1",
      "implementation_stage": "PR6",
      "pit_strategy": "FORWARD_ARCHIVE",
      "route_id": "official.govcn_policy",
      "source_family": "govcn"
    },
    {
      "contract_version": "official_us_policy_v1",
      "implementation_stage": "PR5",
      "pit_strategy": "FORWARD_ARCHIVE",
      "route_id": "official.us_policy",
      "source_family": "official_us"
    },
    {
      "contract_version": "rke_agent_research_context_pit_v1",
      "implementation_stage": "PR6",
      "pit_strategy": "DERIVED_FROM_PIT_ARCHIVE",
      "route_id": "private.rke_report_intelligence",
      "source_family": "local_private_rke"
    },
    {
      "contract_version": "private_research_report_forward_archive_v1",
      "implementation_stage": "PR6",
      "pit_strategy": "FORWARD_ARCHIVE",
      "route_id": "private.tushare_research_reports",
      "source_family": "tushare"
    },
    {
      "contract_version": "runtime_accepted_outputs_v1",
      "implementation_stage": "PR10",
      "pit_strategy": "LOCAL_RUNTIME_AUTHORITY",
      "route_id": "runtime.accepted_outputs",
      "source_family": "runtime"
    },
    {
      "contract_version": "runtime_account_positions_policy_v1",
      "implementation_stage": "PR10",
      "pit_strategy": "LOCAL_RUNTIME_AUTHORITY",
      "route_id": "runtime.account_positions_policy",
      "source_family": "runtime"
    },
    {
      "contract_version": "runtime_candidate_scope_v1",
      "implementation_stage": "PR10",
      "pit_strategy": "LOCAL_RUNTIME_AUTHORITY",
      "route_id": "runtime.candidate_scope",
      "source_family": "runtime"
    },
    {
      "contract_version": "runtime_market_liquidity_v1",
      "implementation_stage": "PR10",
      "pit_strategy": "LOCAL_RUNTIME_AUTHORITY",
      "route_id": "runtime.market_liquidity",
      "source_family": "runtime"
    },
    {
      "contract_version": "tushare_cn_macro_v1",
      "implementation_stage": "PR7",
      "pit_strategy": "OBSERVED_LIVE",
      "route_id": "tushare.cn_macro",
      "source_family": "tushare"
    },
    {
      "contract_version": "tushare_commodities_v1",
      "implementation_stage": "PR7",
      "pit_strategy": "OBSERVED_LIVE",
      "route_id": "tushare.commodities",
      "source_family": "tushare"
    },
    {
      "contract_version": "tushare_eco_cal_cny_v1",
      "implementation_stage": "PR2",
      "pit_strategy": "OBSERVED_LIVE",
      "route_id": "tushare.eco_cal.cny",
      "source_family": "tushare"
    },
    {
      "contract_version": "tushare_eco_cal_eur_v1",
      "implementation_stage": "PR2",
      "pit_strategy": "OBSERVED_LIVE",
      "route_id": "tushare.eco_cal.eur",
      "source_family": "tushare"
    },
    {
      "contract_version": "tushare_eco_cal_usd_v1",
      "implementation_stage": "PR2",
      "pit_strategy": "OBSERVED_LIVE",
      "route_id": "tushare.eco_cal.usd",
      "source_family": "tushare"
    },
    {
      "contract_version": "tushare_etf_holdings_disclosure_v1",
      "implementation_stage": "PR6",
      "pit_strategy": "AUTHORITATIVE_VINTAGE_REPLAY",
      "route_id": "tushare.etf_holdings",
      "source_family": "tushare"
    },
    {
      "contract_version": "tushare_fx_daily_usd_cnh_v1",
      "implementation_stage": "PR8",
      "pit_strategy": "OBSERVED_LIVE",
      "route_id": "tushare.fx_daily",
      "source_family": "tushare"
    },
    {
      "contract_version": "tushare_institutional_flow_v1",
      "implementation_stage": "PR7",
      "pit_strategy": "OBSERVED_LIVE",
      "route_id": "tushare.institutional_flow",
      "source_family": "tushare"
    },
    {
      "contract_version": "tushare_sector_fundamentals_v1",
      "implementation_stage": "PR4",
      "pit_strategy": "OBSERVED_LIVE",
      "route_id": "tushare.sector_fundamentals",
      "source_family": "tushare"
    },
    {
      "contract_version": "tushare_sector_market_v1",
      "implementation_stage": "PR4",
      "pit_strategy": "OBSERVED_LIVE",
      "route_id": "tushare.sector_market",
      "source_family": "tushare"
    },
    {
      "contract_version": "tushare_us_tycr_nominal_curve_v1",
      "implementation_stage": "PR8",
      "pit_strategy": "OBSERVED_LIVE",
      "route_id": "tushare.us_tycr",
      "source_family": "tushare"
    }
  ],
  "bindings": [
    {
      "agent_id": "china",
      "required_route_ids": [
        "official.cn_macro",
        "tushare.cn_macro",
        "tushare.eco_cal.cny"
      ],
      "stage": "china",
      "tool_id": "get_china_macro_snapshot"
    },
    {
      "agent_id": "us_economy",
      "required_route_ids": [
        "alfred.us_macro",
        "official.us_policy",
        "tushare.eco_cal.usd"
      ],
      "stage": "us_economy",
      "tool_id": "get_us_macro_snapshot"
    },
    {
      "agent_id": "eu_economy",
      "required_route_ids": [
        "ecb.eu_real_economy",
        "ecb.euro_macro",
        "tushare.eco_cal.eur"
      ],
      "stage": "eu_economy",
      "tool_id": "get_eu_macro_snapshot"
    },
    {
      "agent_id": "central_bank",
      "required_route_ids": [
        "composite.cn_rates",
        "official.cn_macro",
        "tushare.eco_cal.cny"
      ],
      "stage": "central_bank",
      "tool_id": "get_central_bank_snapshot"
    },
    {
      "agent_id": "us_financial_conditions",
      "required_route_ids": [
        "alfred.us_macro",
        "market.us_conditions",
        "official.us_policy",
        "tushare.eco_cal.cny",
        "tushare.eco_cal.usd",
        "tushare.fx_daily",
        "tushare.us_tycr"
      ],
      "stage": "us_financial_conditions",
      "tool_id": "get_us_financial_conditions_snapshot"
    },
    {
      "agent_id": "euro_area_financial_conditions",
      "required_route_ids": [
        "ecb.euro_macro",
        "market.euro_fx",
        "tushare.eco_cal.eur"
      ],
      "stage": "euro_area_financial_conditions",
      "tool_id": "get_euro_area_financial_conditions_snapshot"
    },
    {
      "agent_id": "commodities",
      "required_route_ids": [
        "tushare.commodities",
        "tushare.eco_cal.cny",
        "tushare.eco_cal.eur",
        "tushare.eco_cal.usd"
      ],
      "stage": "commodities",
      "tool_id": "get_commodity_conditions_snapshot"
    },
    {
      "agent_id": "institutional_flow",
      "required_route_ids": [
        "tushare.institutional_flow"
      ],
      "stage": "institutional_flow",
      "tool_id": "get_market_positioning_snapshot"
    },
    {
      "agent_id": "semiconductor",
      "required_route_ids": [
        "tushare.sector_fundamentals"
      ],
      "stage": "semiconductor",
      "tool_id": "get_balance_sheet"
    },
    {
      "agent_id": "semiconductor",
      "required_route_ids": [
        "private.tushare_research_reports"
      ],
      "stage": "semiconductor",
      "tool_id": "get_broker_research"
    },
    {
      "agent_id": "semiconductor",
      "required_route_ids": [
        "tushare.sector_fundamentals"
      ],
      "stage": "semiconductor",
      "tool_id": "get_cashflow"
    },
    {
      "agent_id": "semiconductor",
      "required_route_ids": [
        "tushare.etf_holdings"
      ],
      "stage": "semiconductor",
      "tool_id": "get_etf_holdings"
    },
    {
      "agent_id": "semiconductor",
      "required_route_ids": [
        "tushare.sector_fundamentals"
      ],
      "stage": "semiconductor",
      "tool_id": "get_income_statement"
    },
    {
      "agent_id": "semiconductor",
      "required_route_ids": [
        "tushare.sector_market"
      ],
      "stage": "semiconductor",
      "tool_id": "get_indicators"
    },
    {
      "agent_id": "semiconductor",
      "required_route_ids": [
        "tushare.institutional_flow"
      ],
      "stage": "semiconductor",
      "tool_id": "get_industry_moneyflow"
    },
    {